{
  "schema_version": 1,
  "is_template": true,
  "team_code": null,
  "reviewer_code": null,
  "case_code": null,
  "case_group": null,
  "source_type": null,
  "method": null,
  "presentation_order": null,
  "code_version": null,
  "model_profile": null,
  "context_hash": null,
  "attempt_result": null,
  "active_review_seconds": null,
  "human_review_completed": null,
  "material_corrections": null,
  "correction_notes": [],
  "useful_evidence_notes": [],
  "had_followup_case_opportunity": null,
  "used_on_another_case": null,
  "willingness_to_pay": "not_asked",
  "conditions_for_continued_use": []
}
